{
  "versao": 1,
  "nome": "Fábrica Exemplo (fictício)",
  "fontes": {
    "titulo": {
      "familia": "'Bebas Neue', Impact, sans-serif",
      "peso": 400,
      "url": "https://fonts.googleapis.com/css2?family=Bebas+Neue&display=swap",
      "caixa": "uppercase"
    },
    "corpo": {
      "familia": "'Helvetica Neue', Helvetica, Arial, sans-serif",
      "peso": 300,
      "url": null
    }
  },
  "cores": {
    "texto": "#111111",
    "texto_suave": "#555555",
    "acento": "#2563EB"
  },
  "raio": { "card": "12px", "grande": "24px" },
  "medidas": { "titulo_largura_char": 0.42 }
}
