{
  "versao": 1,
  "nome": "mK Orbit (vocabulário claro)",
  "fontes": {
    "titulo": {
      "familia": "'Anton', sans-serif",
      "peso": 400,
      "url": "https://fonts.googleapis.com/css2?family=Anton&display=swap",
      "caixa": "uppercase"
    },
    "corpo": {
      "familia": "'Helvetica Neue', 'Helvetica', Arial, sans-serif",
      "peso": 300,
      "url": null
    }
  },
  "cores": {
    "fundo": "#FFFFFF",
    "texto": "#111111",
    "texto_suave": "#555555",
    "borda": "#E2E2E2",
    "borda_forte": "rgba(0,0,0,.32)",
    "superficie": "#F5F5F5",
    "linha_leve": "#EDEDED",
    "apagado": "#C4C4C4",
    "inverso": "#FFFFFF",
    "alerta": "#E10600",
    "acento": "#7C3AED"
  },
  "raio": { "card": "16px", "grande": "32px" },
  "medidas": { "titulo_largura_char": 0.46 }
}
